{
  "eventId": "EVTMSG-001",
  "eventType": "ticket.checked-in",
  "schemaVersion": 1,
  "occurredAt": "2026-08-03T03:00:00Z",
  "correlationId": "corr-1234567890abcdef",
  "aggregateId": "BOOKING-001",
  "data": {
    "ticketId": "TICKET-001",
    "bookingId": "BOOKING-001",
    "status": "CHECKED_IN",
    "gateId": "GATE-001",
    "resourceVersion": 1
  }
}
