{
  "eventId": "EVTMSG-001",
  "eventType": "payment.cancelled",
  "schemaVersion": 1,
  "occurredAt": "2026-08-03T03:00:00Z",
  "correlationId": "corr-1234567890abcdef",
  "aggregateId": "BOOKING-001",
  "data": {
    "paymentId": "PAYMENT-001",
    "bookingId": "BOOKING-001",
    "status": "CANCELLED",
    "reason": "Requested cancellation",
    "resourceVersion": 1
  }
}
